Sheet: Project Claim Form
B1: Animal Network Project Claim Form
B4: Animal Network Project Information - Combined
B5: Name of Animal Network: | C5: oskar test
B6: Project Name: | C6: 1
B7: Project Type
B8: Contract start date: | C8: 2015-06-01
B9: Contract completion date: | C9: 2016-06-01
B10: Event dates: | C10: 2012-12-13, 2013,13,13
B11: Other relevant Information: | C11: whatever yo
B13: Item | D13: Yo | E13: Never | F13: Justein | G13: 2015 01 03 | H13: Today
B14: Cats | D14: 100 | E14: 200 | F14: 0 | G14: 75 | H14: =RC[-1]-RC[-3]-RC[-2] -> -125
B15: Dogs | D15: 200 | E15: 100 | F15: 0 | G15: 225 | H15: =RC[-1]-RC[-3]-RC[-2] -> 125
B16: Birds | D16: 300 | E16: 0 | F16: 0 | G16: 0 | H16: =RC[-1]-RC[-3]-RC[-2] -> 0
B17: Maps | D17: 0 | E17: 400 | F17: 0 | G17: 17.25 | H17: =RC[-1]-RC[-3]-RC[-2] -> -382.75
B18: Mereetings | D18: 0 | E18: 0 | F18: 0 | G18: 33 | H18: =RC[-1]-RC[-3]-RC[-2] -> 33
B19: Toho | D19: 150 | E19: 0 | F19: 0 | G19: 0 | H19: =RC[-1]-RC[-3]-RC[-2] -> 0
B20: More cats costs, as related to delivery of events and marketing activities. | D20: 0 | E20: 0 | F20: 0 | G20: 75 | H20: =RC[-1]-RC[-3]-RC[-2] -> 75
B22: Totals (Internal Use) | D22: =SUM(R[-8]C:R[-1]C) -> 750 | E22: =SUM(R[-8]C:R[-1]C) -> 700 | F22: =SUM(R[-8]C:R[-1]C) -> 0 | G22: =SUM(R[-8]C:R[-1]C) -> 425.25 | H22: =RC[-1]-RC[-3]-RC[-2] -> -274.75
B24: Anticipated Cash Flow Requests | C24: Note: If there are any changes, please make the anticipated project cash flow request changes for the whole year, not to exceed 75% of the total expense before tax.
B25: From April 2016 - March 2017
B26: REPORTING PERIOD / COST CATEGORY | D26: Apr | E26: May | F26: June | G26: July | H26: Aug
B27: Projected Cash Flow Across All Projects (Most Updated) | D27: 0 | E27: 0 | F27: 0 | G27: 0 | H27: 0
B28: Projected Cash Flow (Per Budget - Internal Use Only) | D28: 0 | E28: 0 | F28: 0 | G28: 0 | H28: 0
F29: =SUM(R[-2]C[-2]:R[-2]C) -> 0
B30: Woot
B31: 0.75 | D31: =(R[-3]C)*(RC[-2]) -> 0 | F31: =(R[-3]C[-1])*(RC[-4]) -> 0 | G31: =(R[-3]C[-1])*(RC[-5]) -> 0 | H31: =(R[-3]C[-1])*(RC[-6]) -> 0
B33: Yo | D33: =SUM(R[-6]C[2]:R[-1]C[2]) -> 0 | F33: =SUM(R[-6]C[1]:R[-1]C[1]) -> 0 | G33: =SUM(R[-6]C[1]:R[-1]C[1]) -> 0 | H33: =SUM(R[4]C[1]:R[9]C[1]) -> 0
B35: Notes: Create a formula where the monthly cash flow is an aggregate amount from all of the projects for each Animal Network.
I36: Sept | J36: Oct | K36: Nov | L36: Dec | M36: Jan | N36: Feb | O36: Mar | P36: TOTAL forecasted
D37: Total Requested | F37: Total Budgeted | G37: Total Spent | H37: Variance | I37: 0 | J37: 0 | K37: 0 | L37: 0 | M37: 0 | N37: 0 | O37: 0 | P37: =SUM(RC[-12]:RC[-1]) -> 0
D38: =#REF!+#REF!+#REF!+#REF!+#REF!+#REF!+#REF!+#REF!+#REF!+#REF!+#REF!+#REF! -> #REF! | F38: =#REF! -> #REF! | G38: =#REF! -> #REF! | H38: =RC[-4]-RC[-1] -> #REF! | I38: 0 | J38: 0 | K38: 0 | L38: 0 | M38: 0 | N38: 0 | O38: 0 | P38: =SUM(RC[-12]:RC[-1]) -> #REF!
I39: =SUM(R[-2]C[-2]:R[-2]C) -> 0 | L39: =SUM(R[-2]C[-2]:R[-2]C) -> 0 | O39: =SUM(R[-2]C[-2]:R[-2]C) -> 0
I41: =(R[-13]C[-1])*(R[-10]C[-7]) -> 0 | J41: =(R[-3]C[-1])*(R[-10]C[-8]) -> 0 | K41: =(R[-3]C[-1])*(R[-10]C[-9]) -> 0 | L41: =(R[-3]C[-1])*(R[-10]C[-10]) -> 0 | M41: =(R[-3]C[-1])*(R[-10]C[-11]) -> 0 | N41: =(R[-3]C[-1])*(R[-10]C[-12]) -> 0 | O41: =(R[-3]C[-1])*(R[-10]C[-13]) -> 0 | P41: =(R[-3]C[-1])*(R[-10]C[-14]) -> 0 | Q41: =SUM(RC[-14]:RC[-1]) -> 0
I43: =SUM(R[-6]C[1]:R[-1]C[1]) -> 0 | J43: =SUM(R[-6]C[1]:R[-1]C[1]) -> 0 | K43: =SUM(R[-6]C[1]:R[-1]C[1]) -> 0 | L43: =SUM(R[-6]C[1]:R[-1]C[1]) -> 0 | M43: =SUM(R[-6]C[1]:R[-1]C[1]) -> 0 | N43: =SUM(R[-6]C[1]:R[-1]C[1]) -> 0 | O43: =SUM(R[-6]C[1]:R[-1]C[1]) -> #REF! | P43: =SUM(R[-6]C[1]:R[-1]C[1]) -> 0 | Q43: =SUM(R[-6]C[1]:R[-1]C[1]) -> 0

Sheet: Sheet2
B1: Animal Network Project Claim Form
B4: Animal Network Project Information - Combined
B5: Name of Animal Network: | C5: oskar test
B6: Project Name: | C6: 2
B7: Project Type
B8: Contract start date: | C8: 2015-06-01
B9: Contract completion date: | C9: 2016-06-01
B10: Event dates: | C10: 2012-12-13, 2013,13,13
B11: Other relevant Information: | C11: whatever yo
B13: Item | D13: Dogs | E13: cats | F13: LOl | G13: Whatsup | H13: Variance
B14: Cats | D14: 1 | E14: 10 | F14: 0 | G14: 75 | H14: =RC[-1]-RC[-3]-RC[-2] -> 65
B15: Dogs | D15: 2 | E15: 11 | F15: 0 | G15: 225 | H15: =RC[-1]-RC[-3]-RC[-2] -> 214
B16: Birds | D16: 3 | E16: 12 | F16: 0 | G16: 0 | H16: =RC[-1]-RC[-3]-RC[-2] -> -12
B17: Maps | D17: 4 | E17: 13 | F17: 0 | G17: 17.25 | H17: =RC[-1]-RC[-3]-RC[-2] -> 4.25
B18: Mereetings | D18: 5 | E18: 14 | F18: 0 | G18: 33 | H18: =RC[-1]-RC[-3]-RC[-2] -> 19
B19: Toho | D19: 6 | E19: 15 | F19: 0 | G19: 0 | H19: =RC[-1]-RC[-3]-RC[-2] -> -15
B20: More cats costs, as related to delivery of events and marketing activities. | D20: 7 | E20: 16 | F20: 0 | G20: 75 | H20: =RC[-1]-RC[-3]-RC[-2] -> 59
B22: Totals (Internal Use) | D22: =SUM(R[-8]C:R[-1]C) -> 28 | E22: =SUM(R[-8]C:R[-1]C) -> 91 | F22: =SUM(R[-8]C:R[-1]C) -> 0 | G22: =SUM(R[-8]C:R[-1]C) -> 425.25 | H22: =RC[-1]-RC[-3]-RC[-2] -> 334.25
B24: Anticipated Cash Flow Requests | C24: Note: If there are any changes, please make the anticipated project cash flow request changes for the whole year, not to exceed 75% of the total expense before tax.
B25: From April 2016 - March 2017
B26: REPORTING PERIOD / COST CATEGORY | D26: Apr | E26: May | F26: June | G26: July | H26: Aug
B27: Projected Cash Flow Across All Projects (Most Updated) | D27: 0 | E27: 0 | F27: 0 | G27: 0 | H27: 0
B28: Projected Cash Flow (Per Budget - Internal Use Only) | D28: 0 | E28: 0 | F28: 0 | G28: 0 | H28: 0
F29: =SUM(R[-2]C[-2]:R[-2]C) -> 0
B30: Woot
B31: 0.75 | D31: =(R[-3]C)*(RC[-2]) -> 0 | F31: =(R[-3]C[-1])*(RC[-4]) -> 0 | G31: =(R[-3]C[-1])*(RC[-5]) -> 0 | H31: =(R[-3]C[-1])*(RC[-6]) -> 0
B33: Yo | D33: =SUM(R[-6]C[2]:R[-1]C[2]) -> 0 | F33: =SUM(R[-6]C[1]:R[-1]C[1]) -> 0 | G33: =SUM(R[-6]C[1]:R[-1]C[1]) -> 0 | H33: =SUM(R[4]C[1]:R[9]C[1]) -> 0
B35: Notes: Create a formula where the monthly cash flow is an aggregate amount from all of the projects for each Animal Network.
I36: Sept | J36: Oct | K36: Nov | L36: Dec | M36: Jan | N36: Feb | O36: Mar | P36: TOTAL forecasted
D37: Total Requested | F37: Total Budgeted | G37: Total Spent | H37: Variance | I37: 0 | J37: 0 | K37: 0 | L37: 0 | M37: 0 | N37: 0 | O37: 0 | P37: =SUM(RC[-12]:RC[-1]) -> 0
D38: =#REF!+#REF!+#REF!+#REF!+#REF!+#REF!+#REF!+#REF!+#REF!+#REF!+#REF!+#REF! -> #REF! | F38: =#REF! -> #REF! | G38: =#REF! -> #REF! | H38: =RC[-4]-RC[-1] -> #REF! | I38: 0 | J38: 0 | K38: 0 | L38: 0 | M38: 0 | N38: 0 | O38: 0 | P38: =SUM(RC[-12]:RC[-1]) -> #REF!
I39: =SUM(R[-2]C[-2]:R[-2]C) -> 0 | L39: =SUM(R[-2]C[-2]:R[-2]C) -> 0 | O39: =SUM(R[-2]C[-2]:R[-2]C) -> 0
I41: =(R[-13]C[-1])*(R[-10]C[-7]) -> 0 | J41: =(R[-3]C[-1])*(R[-10]C[-8]) -> 0 | K41: =(R[-3]C[-1])*(R[-10]C[-9]) -> 0 | L41: =(R[-3]C[-1])*(R[-10]C[-10]) -> 0 | M41: =(R[-3]C[-1])*(R[-10]C[-11]) -> 0 | N41: =(R[-3]C[-1])*(R[-10]C[-12]) -> 0 | O41: =(R[-3]C[-1])*(R[-10]C[-13]) -> 0 | P41: =(R[-3]C[-1])*(R[-10]C[-14]) -> 0 | Q41: =SUM(RC[-14]:RC[-1]) -> 0
I43: =SUM(R[-6]C[1]:R[-1]C[1]) -> 0 | J43: =SUM(R[-6]C[1]:R[-1]C[1]) -> 0 | K43: =SUM(R[-6]C[1]:R[-1]C[1]) -> 0 | L43: =SUM(R[-6]C[1]:R[-1]C[1]) -> 0 | M43: =SUM(R[-6]C[1]:R[-1]C[1]) -> 0 | N43: =SUM(R[-6]C[1]:R[-1]C[1]) -> 0 | O43: =SUM(R[-6]C[1]:R[-1]C[1]) -> #REF! | P43: =SUM(R[-6]C[1]:R[-1]C[1]) -> 0 | Q43: =SUM(R[-6]C[1]:R[-1]C[1]) -> 0